{
  "schema_version": "0.1.0",
  "job_id": "bbbbbbbb-bbbb-4bbb-8bbb-bbbbbbbbbbbb",
  "idempotency_key": "idem-sf-plan-extract-0001",
  "capability": "social_flow_plan_extract",
  "requester_user_id": "a1111111-1111-4111-8111-111111111111",
  "subject_user_id": "a1111111-1111-4111-8111-111111111111",
  "conversation_id": "b1111111-1111-4111-8111-111111111111",
  "message_id": "11111111-1111-4111-8111-111111111111",
  "consent_proof_id": "c5555555-5555-4555-8555-555555555555",
  "context": [
    {
      "type": "message_body",
      "value": "We should get dinner next Thursday.",
      "source_id": "11111111-1111-4111-8111-111111111111"
    },
    {
      "type": "message_body",
      "value": "I'm free after 6:30.",
      "source_id": "22222222-2222-4222-8222-222222222222"
    }
  ],
  "requested_at": "2026-07-31T12:00:01Z",
  "deadline_at": "2026-07-31T12:00:31Z",
  "trace_id": "trace-sf1-plan-extract-001"
}
